{"$schema":"https://json-schema.org/draft/2020-12/schema","title":"Quote Request","type":"object","additionalProperties":false,"required":["schemaVersion","sourceEventId","customerId","currency","items"],"properties":{"schemaVersion":{"const":"1.0"},"sourceEventId":{"type":"string","minLength":1,"maxLength":128},"customerId":{"type":"string","minLength":1,"maxLength":128},"currency":{"enum":["USD","CAD","EUR"]},"items":{"type":"array","minItems":1,"maxItems":100,"items":{"type":"object","additionalProperties":false,"required":["sku","description","quantity","unitPriceMinor"],"properties":{"sku":{"type":"string","minLength":1},"description":{"type":"string","minLength":1},"quantity":{"type":"integer","minimum":1,"maximum":100000},"unitPriceMinor":{"type":"integer","minimum":0,"maximum":100000000},"taxRateBps":{"type":"integer","minimum":0,"maximum":10000}}}},"discountBps":{"type":"integer","minimum":0,"maximum":10000},"requestedBy":{"type":"string","minLength":1},"validDays":{"type":"integer","minimum":1,"maximum":90},"metadata":{"type":"object","additionalProperties":{"type":["string","number","boolean"]}}}}
