{"schemaVersion":"1.0","sourceEventId":"crm-quote-1001","customerId":"customer-001","currency":"USD","requestedBy":"sales@example.test","validDays":14,"discountBps":500,"items":[{"sku":"CONSULT-01","description":"Implementation workshop","quantity":2,"unitPriceMinor":50000,"taxRateBps":500},{"sku":"SETUP-01","description":"Local setup","quantity":1,"unitPriceMinor":25000,"taxRateBps":500}]}
